OBJECTID,county,name,sector,address,phone,y,x,hours,website,additional,re_mat,re_num,GL,AL,PL,FE,NONFE,OCC,OPMIX,OPSPORT,ST CANS,ONP,UO,ESCRAP,MRP,RUB,CARBAT,WHITE,EGC,re_lib_serves,drop,broker,curb,other,process,handler,re_type
7,Adair,Adair County Recycling,Recycling centers,64 Service Road Columbia KY 42728,270-378-0782,37.11653,-85.299465,"Mon-Fri 7-3, Sat 7-noon","<a href = ""http://adairwp.clerkinfo.net/?page_id=553"">Click here to access their website</a>",Call the Recycling Center If you would like to take a tour.,"AL, PL( HDPE, PET), FE, NONFE, OCC, CARBAT, OPMIX, ST CANS, WHITE, ONP, ESCRAP, MRP, RUB",13,No,Yes,Yes,Yes,Yes,Yes,Yes,No,Yes,Yes,No,Yes,Yes,Yes,Yes,No,No,"Dropoff, other",Yes,No,No,Yes,No,No,Government facility
31,Bell,Bell Co Recycling Center,Recycling centers,900 North 15th Street Middlesborro KY 40977,606-248-78161,36.618776,-83.708774,N/A,"<a href = ""https://bellcounty.ky.gov/services/Pages/default.aspx"">Click here to access their website</a>",Also accepts motor oil,"GL, AL, PL( HDPE, PET), FE, NONFE, OCC, OPMIX, OPSORT, ST CANS, ONP, UO, ESCRAP, MRP, RUB",14,Yes,Yes,Yes,Yes,Yes,Yes,Yes,Yes,Yes,Yes,Yes,Yes,Yes,Yes,No,No,No,"Dropoff, curbside",Yes,No,Yes,No,No,No,Government facility
71,Breathitt,Breathitt County Recycling Center,Recycling centers,434 Hwy 1812 North Jackson KY 41339,606-666-3818,37.563845,-83.366139,N/A,"<a href = ""https://breathittcounty.ky.gov/Pages/departments.aspx"">Click here to access their website</a>",N/A,"AL, PL( HDPE, PET), OCC, OPMIX, OPSORT, ST CANS, ONP, UO, ESCRAP, MRP",10,No,Yes,Yes,No,No,Yes,Yes,Yes,Yes,Yes,Yes,Yes,Yes,No,No,No,No,Dropoff,Yes,No,No,No,No,No,Government facility
100,Casey,Casey County Road Dept,Recycling centers,1175 Campbellsville Street Liberty KY 42539,606-787-0703,37.32032,-84.947487,N/A,N/A,N/A,"GL, AL, FE, NONFE, OCC, OPMIX, OPSORT, ST CANS, WHITE, ONP, UO, MRP, RUB",13,Yes,Yes,No,Yes,Yes,Yes,Yes,Yes,Yes,Yes,Yes,No,Yes,Yes,No,No,No,Dropoff,Yes,No,No,No,No,No,Government facility
112,Clark,Winchester Municipal Utilities Recycling Center,Recycling centers,150 Maple Street Winchester KY 40391,859-744-1170,37.997074,-84.176483,24/7,"<a href = ""http://www.wmutilities.com/Views/public/Content.aspx?"">Click here to access their website</a>","WMU Voluntary Recycling Center at 175 N. Maple Street is open 24 hours per day, 7 days per week. The recycling center is located behind WMU's Main Office at 150 N. Main Street; however, it is only accessible from the WMU N. Maple Street entrance. Any questions please call 859-744-1170","GL, AL, PL( HDPE, PET), OCC, OPMIX, ST CANS, WHITE, ONP, ESCRAP",9,Yes,Yes,Yes,No,No,Yes,Yes,No,Yes,Yes,No,Yes,No,No,No,Yes,No,"Dropoff, curbside",Yes,No,Yes,No,No,No,Government facility
135,Clinton,Clinton County Recycling Center,Recycling centers,136 Clinton Street Albany KY 42602,606-688-2746,36.687488,-85.129532,N/A,"<a href = ""https://clintoncounty.ky.gov/Pages/default.aspx"">Click here to access their website</a>",N/A,"AL, PL( HDPE, PET), FE, NONFE, OCC, CARBAT, OPSORT, ONP",8,No,Yes,Yes,Yes,Yes,Yes,Yes,No,No,Yes,No,No,No,No,Yes,No,No,"Dropoff, curbside",Yes,No,Yes,No,No,No,Government facility
136,Clinton,Morrison Recycling & TS,Recycling centers,235 Transfer Station Road Albany KY 42602,606-387-9902,36.751328,-85.201057,Mon-Fri 7-4,N/A,N/A,"GL, AL, PL( HDPE, PET), OCC, CARBAT, OPMIX, ONP, UO, MRP",9,Yes,Yes,Yes,No,No,Yes,Yes,Yes,No,Yes,Yes,No,Yes,No,Yes,No,No,"Process, dropoff",Yes,No,No,No,Yes,No,Commercial recycler
165,Estill,Advanced Disposal,Recycling centers,2700 Winchester Rd Irvine KY 40336,606-723-5552,37.737238,-83.984627,N/A,"<a href = ""https://www.advanceddisposal.com/for-home.aspx"">Click here to access their website</a>",N/A,"GL, AL, PL( HDPE, PET), OPMIX, ST CANS, ONP, MRP",7,Yes,Yes,Yes,No,No,No,Yes,No,Yes,Yes,No,No,Yes,No,No,No,No,curbside,No,No,Yes,No,No,No,commercial recycler
168,Estill,Estill County Recycling Center,Recycling centers,532 Kirkland Ave Irvine KY 40336,606-723-5580,37.682957,-83.957684,Mon-Thurs 7-5:30,"<a href = ""http://estillky.com/index.php/estill-road-department-rec"">Click here to access their website</a>",Containers should be rinsed and lids removed.,"AL, PL( HDPE, PET), FE, NONFE, OCC, OPMIX, OPSORT, ST CANS, ONP, ESCRAP, MRP",11,No,Yes,Yes,Yes,Yes,Yes,Yes,Yes,Yes,Yes,No,Yes,Yes,No,No,No,No,"Dropoff, curbside",Yes,No,Yes,No,No,No,Government facility
179,Fleming,Flemingsburg City Maintenance Garage,Recycling centers,140 West Electric Ave Flemingsburg KY 41041,606-845-9307,38.422285,-83.735947,N/A,"<a href = ""http://www.flemingcountyky.us/road.asp"">Click here to access their website</a>",N/A,"GL, AL, PL( HDPE, PET), OCC, OPMIX, WHITE, ONP, MRP",8,Yes,Yes,Yes,No,No,Yes,Yes,No,No,Yes,No,No,No,No,No,Yes,No,"Dropoff, curbside",Yes,No,Yes,No,No,No,Government facility
194,Floyd,Prestonsburg Public Works,Recycling centers,200 North Lake Drive Prestonsburg KY 41653,606-886-3537,37.669224,-82.773853,N/A,N/A,N/A,"PL( HDPE, PET), FE, NONFE, OCC, OPSORT, ST CANS, ONP",7,No,No,Yes,Yes,Yes,No,Yes,No,Yes,Yes,No,No,No,No,No,No,No,"Dropoff, curbside",Yes,No,Yes,No,No,No,Government facility
212,Garrard,Lancaster-Garrard Co. Recycling,Recycling centers,400 South Campbell St Lancaster KY 40444,859-792-1868,37.614201,-84.578106,"Mon-Fri 9-5, Sat 9-4","<a href = ""http://garrardcounty.us/index.php/solid-waste-recycling"">Click here to access their website</a>",N/A,"GL, AL, PL( HDPE, PET), OCC, CARBAT, OPMIX, ST CANS, ONP, ESCRAP",9,Yes,Yes,Yes,No,No,Yes,Yes,No,Yes,Yes,No,Yes,No,No,Yes,No,No,"Handler, Process, Dropoff, curbside",Yes,Yes,No,Yes,Yes,Yes,Government facility
245,Harlan,Harlan County Recycling,Recycling centers,15 S. Highway 413 Baxter KY 40806,606-573-9423,36.875642,-83.300258,N/A,N/A,N/A,"AL, PL( HDPE, PET), FE, NONFE, OCC, OPMIX, ST CANS, WHITE, ONP, ESCRAP, MRP, RUB",12,No,Yes,Yes,Yes,Yes,Yes,Yes,No,Yes,Yes,No,Yes,Yes,Yes,Yes,Yes,No,"Handler, process, dropoff, curbside",Yes,No,Yes,No,Yes,Yes,Government facility
266,Jackson,Jackson County Transfer Station,Recycling centers,McCammon RidgeRoad McKee KY 40447,606-287-7688,37.415351,-83.963531,N/A,"<a href = ""https://jacksoncounty.ky.gov/Services/Pages/Departm"">Click here to access their website</a>",N/A,"AL, PL( HDPE, PET), FE, NONFE, OCC, CARBAT, OPMIX, OPSORT, ST CANS, WHITE, ONP, UO, ESCRAP, MRP, RUB",15,No,Yes,Yes,Yes,Yes,Yes,Yes,Yes,Yes,Yes,Yes,Yes,Yes,Yes,Yes,Yes,No,Dropoff,Yes,No,No,No,No,No,Government facility
295,Knott,Childers Enterprises,Recycling centers,55 Holly hills Villa Road Hindman KY 41822,606-785-3911,37.314941,-82.942778,N/A,"<a href = ""https://www.facebook.com/pages/Childers-Enterprises/"">Click here to access their website</a>",N/A,"AL, PL( HDPE, PET), OCC, OPMIX, OPSORT, ST CANS, ONP, MRP",8,No,Yes,Yes,No,No,Yes,Yes,Yes,Yes,Yes,No,No,Yes,No,No,No,No,"Dropoff, broker",Yes,Yes,No,No,No,No,Commercial recycler
296,Knott,Knott Transfer Station and REcycling Dropoff,Recycling centers,256 Transfer Station Road Hindman KY 41822,606-785-0249,37.318598,-82.973004,N/A,N/A,N/A,"AL, PL( HDPE, PET), FE, NONFE, OCC, OPMIX, OPSORT, ST CANS, WHITE, ONP, UO, MRP, RUB, EGC,",14,No,Yes,Yes,Yes,Yes,Yes,Yes,Yes,Yes,Yes,Yes,Yes,Yes,Yes,Yes,Yes,No,Dropoff,Yes,No,No,No,No,No,Commercial recycler
331,Laurel,London Regional Recycle Facility,Recycling centers,950 TLC Lane London KY 40741,606-864-5521,37.120108,-84.056849,24/7,"<a href = ""https://www.londonky.gov/departments/recycling-progr"">Click here to access their website</a>","We are working hard to accommodate all of your recycling needs.  If you have any questions, feel free to contact us anytime at 606-864-5521. coflsaedge@gmail.com Curbside recycling available for the city of London.","GL, AL, PL( HDPE, PET, PS, PP, PVC, LDPE, OTHER), FE, NONFE, OCC, CARBAT, OPMIX, OPSORT, ST CANS, WHITE, ONP, UO, ESCRAP, MRP, EGC",16,Yes,Yes,Yes,Yes,Yes,Yes,Yes,Yes,Yes,Yes,Yes,Yes,Yes,Yes,Yes,Yes,Yes,"Handler, process, dropoff, curbside",Yes,No,Yes,No,Yes,Yes,Government facility
347,Lawrence,Lawrence County Recycling Center,Recycling centers,175 Business Way Louisa KY 41230,606-638-4102,38.097194,-82.620389,N/A,"<a href = ""http://lawrencekentucky.com/category/recycle-center/"">Click here to access their website</a>","Markets to: Lexington area. &nbsp;2 Marathon hy-press vertical balers, 20/ton, 230 volt, forklift, van. Email: josborne@lycomonline.com","AL, PL( HDPE, PET), OCC, OPMIX, OPSORT, ST CANS, ONP, MRP",8,No,Yes,Yes,No,No,Yes,Yes,Yes,Yes,Yes,No,No,Yes,No,No,No,No,"Handler, Process, Dropoff",Yes,No,No,No,Yes,Yes,Government facility
366,Leslie,Leslie County Recycling Center,Recycling centers,24778 HWY 421 Hyden KY 41749,606-672-4103,37.14716,-83.411094,N/A,"<a href = ""http://www.lesliecoky.com/government/solid-waste-coo"">Click here to access their website</a>",N/A,"AL, PL( HDPE, PET), OCC, OPMIX, ST CANS, ONP, ESCRAP, MRP",8,No,Yes,Yes,No,No,Yes,Yes,No,Yes,Yes,No,Yes,Yes,No,No,No,No,Dropoff,Yes,No,No,No,No,No,Government facility
395,Lewis,Lewis County Recycling Center,Recycling centers,199 County Drive Vanceburg KY 41179,606-796-0624,38.590529,-83.350549,Mon-Fri 7-3:30,"<a href = ""https://lewiscounty.ky.gov/Departments-and-Services/"">Click here to access their website</a>",N/A,"GL, AL, PL( HDPE, PET, OTHER), FE, NONFE, OCC, CARBAT, OPMIX, OPSORT, ST CANS, WHITE, ONP, UO, ESCRAP, MRP, RUB",16,Yes,Yes,Yes,Yes,Yes,Yes,Yes,Yes,Yes,Yes,Yes,Yes,Yes,Yes,Yes,Yes,No,"Process, Dropoff",Yes,No,No,No,Yes,No,Government facility
396,Lewis,Vanceburg Recycling,Recycling centers,90 River Street Vanceburg KY 41179,606-796-6003,38.604004,-83.323793,N/A,"<a href = ""http://www.cityofvanceburg.com/publicworks"">Click here to access their website</a>",N/A,"GL, AL, PL( HDPE, PET, OTHER), FE, NONFE, OCC, OPMIX, OPSORT, ST CANS, ONP, ESCRAP",11,Yes,Yes,Yes,Yes,Yes,Yes,Yes,Yes,Yes,Yes,No,Yes,No,No,No,No,No,"Handler, Dropoff, Curbside",Yes,No,Yes,No,No,Yes,Government facility
408,Lincoln,Lincoln Co. Recycling Center,Recycling centers,553 KY HWY 698 Stanford KY 40484,606-365-9779,37.4995,-84.656397,N/A,"<a href = ""http://www.lincolnky.com/departments/solid_waste.php"">Click here to access their website</a>","Also accept old magazines-residential mix. Market to: cardboard, mixed bales - Rumpke, e waste - E-cyclers, Scrap metal, cans - Eastern, KY","AL, PL( HDPE, PET), FE, OCC, OPMIX, ST CANS, WHITE, ONP",8,No,Yes,Yes,Yes,No,Yes,Yes,No,Yes,Yes,No,No,No,No,No,No,Yes,"Handler, process, dropoff, curbside",Yes,Yes,Yes,No,Yes,Yes,Government facility
427,Madison,Berea College,Recycling centers,310 N. Main Street,859-985-3844,37.576206,-84.289259,N/A,N/A,FOR BEREA COLLEGE STAFFAND STUDENTS ONLY. DROP-OFF BINS AT MANY CAMPUS LOCATIONS. ALSO ACCEPTS MAGAZINES,"GL, AL, PL( HDPE, PET), OCC, OPMIX, OPSORT, ST CANS, ONP",8,Yes,Yes,Yes,No,No,Yes,Yes,Yes,Yes,Yes,No,No,No,No,No,No,No,"Handler, dropoff",Yes,No,No,No,No,Yes,N/A
430,Madison,Madison Co. SW Recycling Program,Recycling centers,321 North Madison Ave Richmond KY 40475,859-624-4709,37.727307,-84.289143,N/A,"<a href = ""https://madisoncountyky.us/index.php/recycling-progra"">Click here to access their website</a>",Bins for the recycling of electronic items are located at 208 Clarksville Lane and sent to Winchester for recycling. This service is offered free to the citizens of Madison County.,"AL, OCC, OPMIX, OPSORT, ST CANS, ONP, ESCRAP",7,No,Yes,No,No,No,Yes,Yes,Yes,Yes,Yes,No,Yes,No,No,No,No,No,Curbside,No,No,Yes,No,No,No,Government Facility
432,Madison,Richmond-Madison Co. Recycling Ctr.,Recycling centers,550 Recycle Drive Richmond KY 40475,859-625-0202,37.726422,-84.290442,N/A,"<a href = ""https://www.richmond.ky.us/recycling-faqs-information/"">Click here to access their website</a>",Our innovative drop chute design makes your visit to the center a pleasant one. Simply open the doors and place materials inside the chutes. The materials are then ready for our employees to gather on the inside. This design saves both time and money,"GL, AL, PL( HDPE, PET), OCC, OPMIX, OPSORT, ST CANS, ONP",8,Yes,Yes,Yes,No,No,Yes,Yes,Yes,Yes,Yes,No,No,No,No,No,No,No,"Process, dropoff, curbside",Yes,No,Yes,No,Yes,No,Government Facility
453,Magoffin,Magoffin County Recycling Center,Recycling centers,201 East Maple Street Salyersville KY 41465,606-349-6336,37.752189,-83.066233,N/A,N/A,Offer pickup from businesses and schools. Email: frankie_collett@hotmail.com,"AL, PL( HDPE, PET, OTHER), NONFE, OCC, OPMIX, OPSORT, ST CANS, ONP, MRP",9,No,Yes,Yes,No,Yes,Yes,Yes,Yes,Yes,Yes,No,No,Yes,No,No,No,No,"Process, Dropoff",Yes,No,No,No,Yes,No,Government Facility
476,McCreary,Co. Recycling/TS Center,Recycling centers,Cabin Creek Rd. Stearns KY 42647,606-376-2413,36.701426,-84.46307,N/A,"<a href = ""http://www.mccrearycounty.com/Departments.html"">Click here to access their website</a>",Accepts escrap and used motor oil,"AL, PL( HDPE, PET, OTHER), FE, NONFE, OCC, OPMIX, OPSORT, ST CANS, ONP, UO, ESCRAP, MRP",12,No,Yes,Yes,Yes,Yes,Yes,Yes,Yes,Yes,Yes,Yes,Yes,Yes,No,No,No,No,Dropoff,Yes,No,No,No,No,No,Government facility
497,Montgomery,Rumpke Recycling Inc.,Recycling centers,30 Lairson Road Jeffersonville KY 40337,859-498-3322,37.950248,-83.952076,Mon-Fri 8-5,"<a href = ""https://www.rumpke.com/"">Click here to access their website</a>",N/A,"GL, AL, PL( HDPE, PET), OCC, CARBAT, OPMIX, ST CANS, ONP, UO, MRP",10,Yes,Yes,Yes,No,No,Yes,Yes,No,Yes,Yes,Yes,No,Yes,No,No,Yes,No,"Dropoff, curbside",Yes,No,Yes,No,No,No,Commercial recycler
512,Morgan,Morgan Co. Solid Waste & Recycling,Recycling centers,239 Co. Garage Road West Liberty KY 41472,606-743-4845,37.904944,-83.242463,Mon-Fri 8-4,"<a href = ""https://morgancounty.ky.gov/Pages/Services.aspx"">Click here to access their website</a>",N/A,"AL, OCC, OPMIX, OPSORT, ST CANS, ONP, UO, MRP",8,No,Yes,No,No,No,Yes,Yes,Yes,Yes,Yes,Yes,Yes,No,No,No,No,No,Dropoff,Yes,No,No,No,No,No,Government facility
534,Perry,Hazard Recycling AKA Gorman Hollow,Recycling centers,105 Gorman Hollow Road Hazard KY 41701,606-439-1863,37.240819,-83.198651,Mon-Fri 7-4,N/A,Also accept magazines and paperback books.,"GL, AL, PL( HDPE, PET), OCC, OPMIX, ST CANS, ONP",7,Yes,Yes,Yes,No,No,Yes,Yes,No,Yes,Yes,No,No,No,No,No,No,No,"Handler, dropoff",Yes,No,No,No,No,Yes,Government facility
570,Pike,Black Gem Park (County Drop-off),Recycling centers,Black Gem Road Pikeville KY 41501,606-432-6245,37.6442481,-82.2649189,N/A,N/A,Approximate location,"AL, PL( HDPE, PET), OCC, OPMIX, OPSORT, ST CANS, ONP, MRP",8,No,Yes,Yes,No,No,Yes,Yes,Yes,Yes,Yes,No,No,Yes,No,No,No,No,Dropoff,Yes,No,No,No,No,No,Government facility
571,Pike,Pike County Solid Waste,Recycling centers,170 Ford Mountain Road Pikeville KY 41501,606-631-0902,37.568361,-82.453139,N/A,"<a href = ""http://www.pikecountyky.gov/?page_id=31"">Click here to access their website</a>",N/A,"GL, AL, PL( HDPE, PET), NONFE, OCC, CARBAT, OPMIX, OPSORT, ST CANS, ONP, UO, MRP, RUB, EGC",14,Yes,Yes,Yes,No,Yes,Yes,Yes,Yes,Yes,Yes,Yes,Yes,Yes,Yes,Yes,Yes,Yes,Dropoff,Yes,No,No,No,No,No,Government facility
592,Powell,Powell County Transfer Station,Recycling centers,2479 Stanton Road Stanton KY 40380,606-481-9474,37.838728,-83.89572,Mon-Fri 7:30- 5,N/A,N/A,"GL, AL, PL( HDPE, PET), NONFE, OCC, OPMIX, WHITE, ONP",8,Yes,Yes,Yes,No,Yes,Yes,Yes,No,No,Yes,No,No,No,No,No,Yes,No,Dropoff,Yes,No,No,No,No,No,Government facility
615,Pulaski,Pulaski Regional Recycling Center,Recycling centers,218 W HWY 80 Somerset KY 42503,606-677-0320,37.092129,-84.623936,N/A,"<a href = ""http://pcgovt.com/solid-waste-and-recycling/"">Click here to access their website</a>",N/A,"AL, PL( HDPE, PET), FE, NONFE, OCC, CARBAT, OPMIX, OPSORT, ST CANS, ONP, UO, ESCRAP, MRP, EGC",14,No,Yes,Yes,Yes,Yes,Yes,Yes,Yes,Yes,Yes,Yes,Yes,Yes,Yes,Yes,No,No,Dropoff,Yes,No,No,No,No,No,Government facility
640,Rockcastle,Rockcastle County Recycling Center,Recycling centers,2528 South Wilderness Road Mount Vernon KY 40456,606-256-1902,37.339914,-84.3022642,N/A,"<a href = ""http://www.rockcastlecountyky.com/"">Click here to access their website</a>",N/A,"AL, PL( HDPE, PET), FE, NONFE, OCC, CARBAT, OPMIX, OPSORT, ST CANS, WHITE, ONP, UO, ESCRAP, MRP",14,No,Yes,Yes,Yes,Yes,Yes,Yes,Yes,Yes,Yes,Yes,Yes,Yes,Yes,No,Yes,No,Dropoff,Yes,No,No,No,No,No,Government facility
654,Rowan,Morehead Rowan Community Recycling Center,Recycling centers,325 Triplett Street Morehead KY 40351,606-784-1250,38.230298,-83.460379,"Mon-Fri 8:30-4:30, Sat 9:30-1:30","<a href = ""https://moreheadrecycling.org/"">Click here to access their website</a>","Also accepts grocery bags, shrink-wrap, magazines, books, and paperboard.","GL, AL, PL( HDPE, PET, PP, LDPE), OCC, OPMIX, OPSORT, ST CANS, ONP, UO, ESCRAP, MRP",11,Yes,Yes,Yes,No,No,Yes,Yes,Yes,Yes,Yes,Yes,Yes,Yes,No,No,No,No,"Handler, process, dropoff",Yes,No,No,No,Yes,Yes,Government facility
673,Russell,Russell Co. Recycling Facility,Recycling centers,199 Landfill Road Russell Springs KY 42642,270-585-1416,37.037956,-85.061021,Mon-Fri 7:30-3:30,N/A,N/A,"GL, AL, PL( HDPE, PET), OCC, OPMIX, OPSORT, ST CANS, WHITE, ONP, MRP",10,Yes,Yes,Yes,No,No,Yes,Yes,Yes,Yes,Yes,No,No,Yes,No,No,Yes,No,Dropoff,Yes,No,No,No,No,No,Government facility
704,Whitley,Cedar Ridge Ministries Recycling,Recycling centers,537 South 10th Street Williamsburg KY 40769,606-549-1372,36.7682174,-84.1595885,"Mon, Tues, Thurs, Fri 9-3","<a href = ""http://www.cedaridgeministries.org/recycling-services/"">Click here to access their website</a>",ALSO ACCEPTS MAGAZINES,"AL, PL( HDPE, PET), OCC, OPMIX, ST CANS, ONP",6,No,Yes,Yes,No,No,Yes,Yes,No,Yes,Yes,No,No,No,No,No,No,No,"Handler, dropoff",Yes,No,No,No,No,Yes,Commercial recycler
705,Whitley,City of Corbin Recycling,Recycling centers,701 Main Street Corbin KY 40701,606-523-6532,36.942802,-84.094468,Mon-Fri 7 -3:30,"<a href = ""https://corbin-ky.gov/corbin-recycling/"">Click here to access their website</a>",N/A,"GL, AL, PL( HDPE, PET), OCC, OPMIX, ST CANS, ONP",7,Yes,Yes,Yes,No,No,Yes,Yes,No,Yes,Yes,No,No,No,No,No,No,No,"Handler, dropoff",Yes,No,No,No,No,Yes,Government facility